{
  "schemaVersion": 1,
  "source": {
    "id": "sk",
    "senderCountry": "SK",
    "publisher": "Packeta Slovakia s.r.o.",
    "currency": "EUR",
    "sha256": "f5612320737a9f6c5b93e3fad2f8865ac129e55f90db95fe54173aa31ff6235b",
    "validFrom": "2026-09-01",
    "language": "sk"
  },
  "services": [
    {
      "id": "home:SK:131",
      "mode": "HOME",
      "destination": "SK",
      "carrierCountry": "SK",
      "carrierIds": [
        131
      ],
      "carrierName": "Packeta Home",
      "title": "Slovensko: SK Packeta Home HD (ID dopravcu 131)",
      "variant": null,
      "suspended": false,
      "leadTimeDays": {
        "min": 1,
        "max": 1
      },
      "currency": "EUR",
      "tiers": [
        {
          "maxKg": 1,
          "variant": null,
          "price": {
            "depot": 3.6,
            "zpoint": 4
          }
        },
        {
          "maxKg": 2,
          "variant": null,
          "price": {
            "depot": 4.15,
            "zpoint": 4.55
          }
        },
        {
          "maxKg": 5,
          "variant": null,
          "price": {
            "depot": 4.35,
            "zpoint": 4.75
          }
        },
        {
          "maxKg": 10,
          "variant": null,
          "price": {
            "depot": 5.72,
            "zpoint": 6.12
          }
        },
        {
          "maxKg": 15,
          "variant": null,
          "price": {
            "depot": 6.85,
            "zpoint": 7.25
          }
        }
      ],
      "cod": {
        "available": true,
        "max": {
          "amount": 700,
          "currency": "EUR"
        },
        "tiers": [
          {
            "upTo": {
              "amount": 700,
              "currency": "EUR"
            },
            "fee": 1
          }
        ],
        "cardPaymentPct": 1.2
      },
      "insurance": {
        "max": {
          "amount": 700,
          "currency": "EUR"
        },
        "tiers": [
          {
            "upTo": {
              "amount": 700,
              "currency": "EUR"
            },
            "fee": 0,
            "included": true
          }
        ]
      },
      "limits": {
        "maxWeightKg": 15,
        "minDimsCm": [
          10,
          7,
          1
        ],
        "maxSideCm": 120,
        "maxSumCm": 150,
        "byWeight": [
          {
            "maxKg": 5,
            "maxSideCm": 60,
            "maxSumCm": 120
          },
          {
            "maxKg": 15,
            "maxSideCm": 120,
            "maxSumCm": 150
          }
        ],
        "fromSectionDefaults": true
      },
      "fees": [
        {
          "code": "risk_surcharge",
          "label": "Rizikový príplatok",
          "amount": 1.2,
          "currency": "EUR",
          "pct": null,
          "byWeight": null,
          "note": null,
          "description": "Cena za zásielku - príplatok za prácu v extrémnych podmienkach, v čase núdzového stavu, mimoriadnej situácie, či obdobných stavoch a situáciách vyhlásených na území SR ako aj v čase pretrvávajúcich negatívnych hospodárskych dôsledkov."
        }
      ],
      "volumetric": null,
      "notes": [
        "UPOZORNENIE: Ak podaná zásielka presiahne parametre nadrozmernej zásielky, je Packeta oprávnená podľa vlastného rozhodnutia buď: doručiť zásielku na adresu za cenu prepravy 10,29 € (bez DPH), ku ktorej sú pripočítané ostatné ceny podľa údajov podanej zásielky (napr. Dobierka, mýtny a palivový príplatok) alebo vrátiť zásielku späť odosielateľovi na jeho náklady."
      ],
      "page": 13
    },
    {
      "id": "home:DE:13613",
      "mode": "HOME",
      "destination": "DE",
      "carrierCountry": "DE",
      "carrierIds": [
        13613
      ],
      "carrierName": "Doručenie na adresu",
      "title": "Nemecko: DE Doručenie na adresu HD (ID dopravcu 13613)",
      "variant": null,
      "suspended": false,
      "leadTimeDays": {
        "min": 2,
        "max": 2
      },
      "currency": "EUR",
      "tiers": [
        {
          "maxKg": 1,
          "variant": null,
          "price": {
            "depot": 6.92,
            "zpoint": 7.32
          }
        },
        {
          "maxKg": 2,
          "variant": null,
          "price": {
            "depot": 7.02,
            "zpoint": 7.42
          }
        },
        {
          "maxKg": 5,
          "variant": null,
          "price": {
            "depot": 7.82,
            "zpoint": 8.22
          }
        },
        {
          "maxKg": 10,
          "variant": null,
          "price": {
            "depot": 8.83,
            "zpoint": 9.23
          }
        },
        {
          "maxKg": 15,
          "variant": null,
          "price": {
            "depot": 10.48,
            "zpoint": 10.88
          }
        }
      ],
      "cod": {
        "available": true,
        "max": {
          "amount": 700,
          "currency": "EUR"
        },
        "tiers": [
          {
            "upTo": {
              "amount": 700,
              "currency": "EUR"
            },
            "fee": 6.2
          }
        ],
        "cardPaymentPct": null
      },
      "insurance": {
        "max": {
          "amount": 700,
          "currency": "EUR"
        },
        "tiers": [
          {
            "upTo": {
              "amount": 25,
              "currency": "EUR"
            },
            "fee": 0,
            "included": true
          },
          {
            "upTo": {
              "amount": 100,
              "currency": "EUR"
            },
            "fee": 1.3
          },
          {
            "upTo": {
              "amount": 200,
              "currency": "EUR"
            },
            "fee": 2
          },
          {
            "upTo": {
              "amount": 400,
              "currency": "EUR"
            },
            "fee": 4
          },
          {
            "upTo": {
              "amount": 700,
              "currency": "EUR"
            },
            "fee": 6.5
          }
        ]
      },
      "limits": {
        "maxWeightKg": 15,
        "minDimsCm": [
          10,
          7,
          1
        ],
        "byWeight": [
          {
            "maxKg": 10,
            "maxSideCm": 70
          },
          {
            "maxKg": 15,
            "maxSideCm": 120
          },
          {
            "maxKg": 10,
            "maxSumCm": 120
          },
          {
            "maxKg": 15,
            "maxSumCm": 150
          }
        ],
        "maxSideCm": 120,
        "maxSumCm": 150
      },
      "fees": [
        {
          "code": "special_handling",
          "label": "Poplatok za osobitné spracovanie zásielky",
          "amount": 10,
          "currency": "EUR",
          "pct": null,
          "byWeight": null,
          "note": "vzťahuje sa k dopravcovi Hermes",
          "description": "Uplatňuje sa k zásielkam, ktoré presahujú max. povolené rozmery dopravcu: 120x60x60 cm a k zásielkam, ktoré nie sú správne zabalené. Za nesprávne zabalené zásielky sa považujú napr. zásielky nezabalené v pevnom (kartónovom) obale, nehranaté zásielky (napr. v tvare valca, trojuholníka, vreca)."
        },
        {
          "code": "delivery_hold",
          "label": "Poplatok za pozastavenie doručovania zásielky",
          "amount": 2.5,
          "currency": "EUR",
          "pct": null,
          "byWeight": null,
          "note": "vzťahuje sa k dopravcovi Hermes",
          "description": "Uplatňuje sa k zásielkam v prípade, ak odosielateľ požiadal o pozastavenie/prerušenie ich doručovania."
        },
        {
          "code": "island_delivery",
          "label": "Poplatok za doručovanie na ostrovy",
          "amount": 8.5,
          "currency": "EUR",
          "pct": null,
          "byWeight": null,
          "note": "vzťahuje sa k dopravcovi Hermes",
          "description": "Uplatňuje sa k zásielkam doručovaným na nemecké ostrovy, zoznam PSČ nájdete na našej web stránke."
        }
      ],
      "volumetric": null,
      "notes": [],
      "page": 42
    },
    {
      "id": "home:BE:4832",
      "mode": "HOME",
      "destination": "BE",
      "carrierCountry": "BE",
      "carrierIds": [
        4832
      ],
      "carrierName": "Holandská pošta",
      "title": "Belgicko: BE Holandská pošta HD (ID dopravcu 4832)",
      "variant": null,
      "suspended": false,
      "leadTimeDays": {
        "min": 3,
        "max": 4
      },
      "currency": "EUR",
      "tiers": [
        {
          "maxKg": 0.5,
          "variant": null,
          "price": {
            "depot": 9.25,
            "zpoint": 9.65
          }
        },
        {
          "maxKg": 1,
          "variant": null,
          "price": {
            "depot": 9.3,
            "zpoint": 9.7
          }
        },
        {
          "maxKg": 2,
          "variant": null,
          "price": {
            "depot": 9.35,
            "zpoint": 9.75
          }
        },
        {
          "maxKg": 5,
          "variant": null,
          "price": {
            "depot": 9.85,
            "zpoint": 10.25
          }
        },
        {
          "maxKg": 10,
          "variant": null,
          "price": {
            "depot": 12.8,
            "zpoint": 13.2
          }
        },
        {
          "maxKg": 15,
          "variant": null,
          "price": {
            "depot": 14.85,
            "zpoint": 15.25
          }
        }
      ],
      "cod": {
        "available": false,
        "max": null,
        "tiers": [],
        "cardPaymentPct": null
      },
      "insurance": {
        "max": {
          "amount": 700,
          "currency": "EUR"
        },
        "tiers": [
          {
            "upTo": {
              "amount": 100,
              "currency": "EUR"
            },
            "fee": 0,
            "included": true
          },
          {
            "upTo": {
              "amount": 200,
              "currency": "EUR"
            },